{
  "$schema": "https://json-schema.org/draft/2020-12/schema",
  "$id": "character.schema.json",
  "title": "Slime Isa character package",
  "type": "object",
  "additionalProperties": false,
  "required": ["version", "characterId", "displayName", "kind", "visualSetId", "body", "hitboxes", "animationTracks"],
  "properties": {
    "$schema": { "type": "string" },
    "version": { "const": 1 },
    "characterId": { "type": "string", "pattern": "^[a-z0-9]+(?:-[a-z0-9]+)*$", "minLength": 1, "maxLength": 80 },
    "displayName": { "type": "string", "minLength": 1, "maxLength": 80 },
    "kind": { "enum": ["player", "enemy", "boss", "npc"] },
    "runtimeRole": { "const": "primary-player" },
    "visualSetId": { "type": "string", "pattern": "^[a-z0-9]+(?:[.-][a-z0-9-]+)+$", "minLength": 3, "maxLength": 120 },
    "attributes": {
      "type": "object", "additionalProperties": false,
      "required": ["strength", "vitality", "agility", "intellect"],
      "properties": {
        "strength": { "type": "number", "minimum": 0 }, "vitality": { "type": "number", "minimum": 0 },
        "agility": { "type": "number", "minimum": 0 }, "intellect": { "type": "number", "minimum": 0 }
      }
    },
    "body": { "$ref": "#/$defs/body" },
    "hitboxes": {
      "type": "object",
      "additionalProperties": { "$ref": "#/$defs/hitbox" },
      "propertyNames": { "$ref": "#/$defs/stableId" }
    },
    "animationTracks": {
      "type": "object",
      "additionalProperties": { "$ref": "#/$defs/track" },
      "propertyNames": { "$ref": "#/$defs/stableId" }
    },
    "player": { "$ref": "#/$defs/player" },
    "enemy": { "$ref": "#/$defs/enemy" },
    "npc": { "$ref": "#/$defs/npc" }
  },
  "allOf": [
    { "if": { "properties": { "kind": { "const": "player" } } }, "then": { "required": ["player"], "not": { "anyOf": [{ "required": ["enemy"] }, { "required": ["attributes"] }] } } },
    { "if": { "properties": { "kind": { "const": "enemy" } } }, "then": { "required": ["enemy"], "not": { "required": ["player", "runtimeRole"] } } },
    { "if": { "properties": { "kind": { "const": "boss" } } }, "then": { "not": { "anyOf": [{ "required": ["player"] }, { "required": ["enemy"] }, { "required": ["npc"] }, { "required": ["runtimeRole"] }, { "required": ["attributes"] }] } } }
    ,{ "if": { "properties": { "kind": { "const": "npc" } } }, "then": {
      "required": ["npc"],
      "not": { "anyOf": [
        { "required": ["player"] },
        { "required": ["enemy"] },
        { "required": ["runtimeRole"] },
        { "required": ["attributes"] }
      ] }
    } }
  ],
  "$defs": {
    "stableId": { "type": "string", "pattern": "^[a-z0-9]+(?:[.-][a-z0-9-]+)*$", "minLength": 1, "maxLength": 80 },
    "numberPair": { "type": "array", "items": { "type": "number" }, "minItems": 2, "maxItems": 2 },
    "body": {
      "type": "object", "additionalProperties": false,
      "required": ["width", "height", "centerOffsetX", "centerOffsetY"],
      "properties": {
        "shape": { "enum": ["rectangle", "circle", "ellipse"] },
        "width": { "type": "number", "exclusiveMinimum": 0 }, "height": { "type": "number", "exclusiveMinimum": 0 },
        "radius": { "type": "number", "exclusiveMinimum": 0 }, "radiusX": { "type": "number", "exclusiveMinimum": 0 }, "radiusY": { "type": "number", "exclusiveMinimum": 0 },
        "centerOffsetX": { "type": "number" }, "centerOffsetY": { "type": "number" }
      },
      "allOf": [
        { "if": { "required": ["shape"], "properties": { "shape": { "const": "circle" } } }, "then": { "required": ["radius"], "not": { "anyOf": [{ "required": ["radiusX"] }, { "required": ["radiusY"] }] } } },
        { "if": { "required": ["shape"], "properties": { "shape": { "const": "ellipse" } } }, "then": { "required": ["radiusX", "radiusY"], "not": { "required": ["radius"] } } }
      ]
    },
    "hitbox": {
      "type": "object", "additionalProperties": false,
      "required": ["shape", "width", "height", "offsetX", "offsetY", "mirrorX"],
      "properties": {
        "shape": { "enum": ["rectangle", "circle", "ellipse"] }, "width": { "type": "number", "exclusiveMinimum": 0 }, "height": { "type": "number", "exclusiveMinimum": 0 },
        "radius": { "type": "number", "exclusiveMinimum": 0 }, "radiusX": { "type": "number", "exclusiveMinimum": 0 }, "radiusY": { "type": "number", "exclusiveMinimum": 0 },
        "offsetX": { "type": "number" }, "offsetY": { "type": "number" }, "mirrorX": { "type": "boolean" }
      },
      "allOf": [
        { "if": { "required": ["shape"], "properties": { "shape": { "const": "circle" } } }, "then": { "required": ["radius"], "not": { "anyOf": [{ "required": ["radiusX"] }, { "required": ["radiusY"] }] } } },
        { "if": { "required": ["shape"], "properties": { "shape": { "const": "ellipse" } } }, "then": { "required": ["radiusX", "radiusY"], "not": { "required": ["radius"] } } }
      ]
    },
    "span": {
      "type": "object", "additionalProperties": false, "required": ["hitboxId", "from", "through"],
      "properties": { "hitboxId": { "$ref": "#/$defs/stableId" }, "from": { "type": "integer", "minimum": 0 }, "through": { "type": "integer", "minimum": 0 } }
    },
    "event": {
      "type": "object", "additionalProperties": false, "required": ["at", "eventId"],
      "properties": { "at": { "type": "integer", "minimum": 0 }, "eventId": { "$ref": "#/$defs/stableId" }, "payload": {} }
    },
    "clip": {
      "type": "object", "additionalProperties": false,
      "required": ["frames", "framesPerSecond", "loop"],
      "properties": {
        "frames": { "type": "array", "minItems": 1, "items": { "type": "integer", "minimum": 0 } },
        "keyframeTimes": { "type": "array", "items": { "type": "integer", "minimum": 0 }, "minItems": 1 },
        "durationSeconds": { "type": "number", "exclusiveMinimum": 0 },
        "framesPerSecond": { "type": "number", "exclusiveMinimum": 0, "maximum": 240 },
        "loop": { "type": "boolean" },
        "loopMode": { "enum": ["wrap", "ping-pong"] },
        "sourceOffset": { "$ref": "#/$defs/numberPair" }
      }
    },
    "track": {
      "type": "object", "additionalProperties": false,
      "properties": { "hitboxSpans": { "type": "array", "items": { "$ref": "#/$defs/span" } }, "events": { "type": "array", "items": { "$ref": "#/$defs/event" } } }
    },
    "player": {
      "type": "object", "additionalProperties": false, "required": ["name"],
      "properties": {
        "name": { "type": "string", "minLength": 1, "maxLength": 80 }
      }
    },
    "npc": {
      "type": "object", "additionalProperties": false,
      "required": ["wanderSpeed", "pauseMinMs", "pauseMaxMs"],
      "properties": {
        "wanderSpeed": { "type": "number", "exclusiveMinimum": 0 },
        "pauseMinMs": { "type": "integer", "minimum": 0 },
        "pauseMaxMs": { "type": "integer", "minimum": 0 }
      }
    },
    "enemy": {
      "type": "object", "additionalProperties": false, "required": ["maxHp", "ai", "drop"],
      "properties": {
        "maxHp": { "type": "number", "exclusiveMinimum": 0 },
        "effectImmunities": { "type": "array", "items": { "enum": ["knockback"] }, "uniqueItems": true },
        "ai": {
          "type": "object", "additionalProperties": false,
          "required": ["aggroRange", "attackRange", "wanderSpeed", "chaseSpeed", "attackCooldownMs", "attackWindupMs", "attackRecoveryMs", "contactDamage", "knockbackStrength", "isRanged", "knockbackResist"],
          "properties": {
            "behavior": { "enum": ["standard", "slime-spider"] },
            "aggroRange": { "type": "number", "minimum": 0 }, "attackRange": { "type": "number", "minimum": 0 }, "leapRange": { "type": "number", "minimum": 0 }, "fleeRange": { "type": "number", "minimum": 0 },
            "wanderSpeed": { "type": "number", "minimum": 0 }, "chaseSpeed": { "type": "number", "minimum": 0 }, "attackCooldownMs": { "type": "integer", "minimum": 0 }, "attackWindupMs": { "type": "integer", "minimum": 0 }, "attackRecoveryMs": { "type": "integer", "minimum": 0 },
            "contactDamage": { "type": "number", "minimum": 0 }, "knockbackStrength": { "type": "number", "minimum": 0 }, "isRanged": { "type": "boolean" }, "isLeaper": { "type": "boolean" }, "projectileSpeed": { "type": "number", "exclusiveMinimum": 0 }, "knockbackResist": { "type": "number", "minimum": 0, "maximum": 1 }
          }
        },
        "drop": {
          "type": "object", "additionalProperties": false, "required": ["coins"],
          "properties": { "coins": { "type": "integer", "minimum": 0 }, "items": { "type": "array", "items": { "type": "object", "additionalProperties": false, "required": ["itemId", "chance"], "properties": { "itemId": { "type": "string" }, "chance": { "type": "number", "minimum": 0, "maximum": 1 }, "count": { "type": "integer", "minimum": 1 } } } } }
        },
        "projectile": { "type": "object", "additionalProperties": false, "required": ["damage"], "properties": { "projectileId": { "$ref": "#/$defs/stableId" }, "assetId": { "type": "string" }, "damage": { "type": "number", "minimum": 0 } }, "anyOf": [{ "required": ["projectileId"] }, { "required": ["assetId"] }] },
        "impactEffect": { "type": "object", "additionalProperties": false, "required": ["visualSetId", "clipId", "distance"], "properties": { "visualSetId": { "type": "string" }, "clipId": { "$ref": "#/$defs/stableId" }, "distance": { "type": "number", "minimum": 0 } } }
      }
    }
  }
}
