{
  "$schema": "../character.schema.json",
  "version": 1,
  "characterId": "fisherman-slime",
  "displayName": "Lily the Fishergirl",
  "kind": "npc",
  "visualSetId": "character.npc.fisherman-slime",
  "body": {
    "shape": "ellipse",
    "width": 36,
    "height": 24,
    "radiusX": 18,
    "radiusY": 12,
    "centerOffsetX": 0,
    "centerOffsetY": 10
  },
  "hitboxes": {},
  "animationTracks": {
    "idle": {
      "hitboxSpans": [],
      "events": []
    },
    "walk-down": {
      "hitboxSpans": [],
      "events": []
    },
    "walk-up": {
      "hitboxSpans": [],
      "events": []
    },
    "walk-left": {
      "hitboxSpans": [],
      "events": []
    },
    "walk-right": {
      "hitboxSpans": [],
      "events": []
    }
  },
  "npc": {
    "wanderSpeed": 30,
    "pauseMinMs": 1400,
    "pauseMaxMs": 3200
  }
}
